<?xml version="1.0"?>

<PowerGridConfig xmlns:xsi="http://www.w3.org/2001/XMLSchema-instance"
       xsi:noNamespaceSchemaLocation="config.xsd">
        <Nx>120</Nx>
        <Ny>120</Ny>
        <Nz>4</Nz>
        <Niter>12</Niter>
        <Ntimeseg>20</Ntimeseg>
        <Ncoils>32</Ncoils>
        <Nshots>4</Nshots>
        <Nphases>1</Nphases>
        <Nimages>1</Nimages>
        <Nslabs>1</Nslabs>
        <Beta>0</Beta>
</PowerGridConfig>
